{
  "activationStatus": "NOT_ELIGIBLE",
  "baselineCommit": "de38b3948f511602af7aa94a9cd80b78e1a00298",
  "familyId": "PSY-F07",
  "handoffs": [],
  "noFindings": [],
  "passA": {
    "evidence": [],
    "existingDispositions": [],
    "gapQuestions": [],
    "ownership": [],
    "relationshipCandidates": [],
    "sourceQueue": [],
    "unresolved": []
  },
  "passB": {
    "authorizations": [],
    "effectAssertions": [],
    "evidenceAssessments": [],
    "happeningTypes": [],
    "occurrences": [],
    "schemaVersion": "1.0.0"
  },
  "productionEligible": false,
  "readiness": {
    "gapsAndDeferrals": false,
    "incidentDispositions": false,
    "membershipDefinitions": false,
    "rdsDerivations": false,
    "relationshipScope": false
  },
  "schemaVersion": "1.0.0",
  "workspaceClass": "NON_GOVERNED_RESEARCH"
}
